{
  "schema_version": 2,
  "skill_version": "0.5.1",
  "audit": {
    "id": "00000000-0000-4000-8000-7abf1164c6f1",
    "started_at": "2026-05-07T00:00:00Z",
    "finished_at": "2026-05-07T00:01:00Z",
    "mode": "standard",
    "scope": [
      "all"
    ],
    "commit": "deadbeefcafe",
    "branch": "main",
    "project_name": "fixture",
    "stack": {
      "ruby": "3.4.7",
      "rails": "8.1.3"
    },
    "ignore_warnings": []
  },
  "summary": {
    "risk_score": 7,
    "verdict": "Fixture: c4-phase-mismatch",
    "top_blocker_ids": [],
    "next_action": "n/a"
  },
  "scorecards": [
    {
      "dimension": "foundation",
      "score": 7,
      "would_be_10": "stub"
    },
    {
      "dimension": "domain-shape",
      "score": 7,
      "would_be_10": "stub"
    },
    {
      "dimension": "spec-stability",
      "score": 7,
      "would_be_10": "stub"
    },
    {
      "dimension": "deploy-and-ci",
      "score": 7,
      "would_be_10": "stub"
    },
    {
      "dimension": "security-and-authz",
      "score": 7,
      "would_be_10": "stub"
    },
    {
      "dimension": "authorization",
      "score": 7,
      "would_be_10": "stub"
    },
    {
      "dimension": "money-and-payments",
      "score": 7,
      "would_be_10": "stub"
    },
    {
      "dimension": "risk-hotspots",
      "score": 7,
      "would_be_10": "stub"
    },
    {
      "dimension": "code-smells",
      "score": 7,
      "would_be_10": "stub"
    },
    {
      "dimension": "test-coverage",
      "score": 7,
      "would_be_10": "stub"
    },
    {
      "dimension": "performance",
      "score": 7,
      "would_be_10": "stub"
    },
    {
      "dimension": "reliability",
      "score": 7,
      "would_be_10": "stub"
    },
    {
      "dimension": "observability",
      "score": 7,
      "would_be_10": "stub"
    },
    {
      "dimension": "background-jobs",
      "score": 7,
      "would_be_10": "stub"
    },
    {
      "dimension": "data-integrity",
      "score": 7,
      "would_be_10": "stub"
    },
    {
      "dimension": "data-governance",
      "score": 7,
      "would_be_10": "stub"
    },
    {
      "dimension": "developer-experience",
      "score": 7,
      "would_be_10": "stub"
    },
    {
      "dimension": "cost-and-scaling",
      "score": 7,
      "would_be_10": "stub"
    }
  ],
  "findings": [
    {
      "id": "f-533563ba6048a190",
      "severity": "high",
      "primary_dimension": "foundation",
      "title": "stub: c4-h1",
      "location": {
        "file": "app/c4-h1.rb",
        "line": 1
      },
      "evidence": {
        "snippet": "c4-h1",
        "normalized": "c4-h1"
      },
      "explanation": "stub",
      "fix_sketch": "stub",
      "tool_origin": "agent",
      "phase": 1
    },
    {
      "id": "f-6a0c2a5337d449e5",
      "severity": "medium",
      "primary_dimension": "domain-shape",
      "title": "stub: c4-m1",
      "location": {
        "file": "app/c4-m1.rb",
        "line": 1
      },
      "evidence": {
        "snippet": "c4-m1",
        "normalized": "c4-m1"
      },
      "explanation": "stub",
      "fix_sketch": "stub",
      "tool_origin": "agent",
      "phase": 1
    },
    {
      "id": "f-13652aa9a9bf5898",
      "severity": "medium",
      "primary_dimension": "spec-stability",
      "title": "stub: c4-m2",
      "location": {
        "file": "app/c4-m2.rb",
        "line": 1
      },
      "evidence": {
        "snippet": "c4-m2",
        "normalized": "c4-m2"
      },
      "explanation": "stub",
      "fix_sketch": "stub",
      "tool_origin": "agent",
      "phase": 2
    }
  ],
  "tooling": {
    "ran": [],
    "missing": [],
    "skipped": []
  },
  "fix_sequence": [
    {
      "phase": 1,
      "name": "p1",
      "estimated_effort": "1d",
      "rationale": "r",
      "finding_ids": [
        "f-533563ba6048a190",
        "f-13652aa9a9bf5898"
      ]
    },
    {
      "phase": 2,
      "name": "p2",
      "estimated_effort": "1d",
      "rationale": "r",
      "finding_ids": [
        "f-6a0c2a5337d449e5"
      ]
    }
  ]
}
