{
  "schema_version": 2,
  "skill_version": "0.5.1",
  "audit": {
    "id": "00000000-0000-4000-8000-21971cd3ef6c",
    "started_at": "2026-05-07T00:00:00Z",
    "finished_at": "2026-05-07T00:01:00Z",
    "mode": "standard",
    "scope": [
      "all"
    ],
    "commit": "deadbeefcafe",
    "branch": "main",
    "project_name": "fixture",
    "stack": {
      "ruby": "3.4.7",
      "rails": "8.1.3"
    },
    "ignore_warnings": []
  },
  "summary": {
    "risk_score": 7,
    "verdict": "Fixture: clean-baseline",
    "top_blocker_ids": [
      "f-ddd6cb9e6b396da0"
    ],
    "next_action": "n/a"
  },
  "scorecards": [
    {
      "dimension": "foundation",
      "score": 7,
      "would_be_10": "stub"
    },
    {
      "dimension": "domain-shape",
      "score": 7,
      "would_be_10": "stub"
    },
    {
      "dimension": "spec-stability",
      "score": 7,
      "would_be_10": "stub"
    },
    {
      "dimension": "deploy-and-ci",
      "score": 7,
      "would_be_10": "stub"
    },
    {
      "dimension": "security-and-authz",
      "score": 7,
      "would_be_10": "stub"
    },
    {
      "dimension": "authorization",
      "score": 7,
      "would_be_10": "stub"
    },
    {
      "dimension": "money-and-payments",
      "score": 7,
      "would_be_10": "stub"
    },
    {
      "dimension": "risk-hotspots",
      "score": 7,
      "would_be_10": "stub"
    },
    {
      "dimension": "code-smells",
      "score": 7,
      "would_be_10": "stub"
    },
    {
      "dimension": "test-coverage",
      "score": 7,
      "would_be_10": "stub"
    },
    {
      "dimension": "performance",
      "score": 7,
      "would_be_10": "stub"
    },
    {
      "dimension": "reliability",
      "score": 7,
      "would_be_10": "stub"
    },
    {
      "dimension": "observability",
      "score": 7,
      "would_be_10": "stub"
    },
    {
      "dimension": "background-jobs",
      "score": 7,
      "would_be_10": "stub"
    },
    {
      "dimension": "data-integrity",
      "score": 7,
      "would_be_10": "stub"
    },
    {
      "dimension": "data-governance",
      "score": 7,
      "would_be_10": "stub"
    },
    {
      "dimension": "developer-experience",
      "score": 7,
      "would_be_10": "stub"
    },
    {
      "dimension": "cost-and-scaling",
      "score": 7,
      "would_be_10": "stub"
    }
  ],
  "findings": [
    {
      "id": "f-ddd6cb9e6b396da0",
      "severity": "blocker",
      "primary_dimension": "foundation",
      "title": "stub: cb-b1",
      "location": {
        "file": "app/cb-b1.rb",
        "line": 1
      },
      "evidence": {
        "snippet": "cb-b1",
        "normalized": "cb-b1"
      },
      "explanation": "stub",
      "fix_sketch": "stub",
      "tool_origin": "agent",
      "phase": 1
    },
    {
      "id": "f-0281af3d4ad9ac0d",
      "severity": "high",
      "primary_dimension": "domain-shape",
      "title": "stub: cb-h1",
      "location": {
        "file": "app/cb-h1.rb",
        "line": 1
      },
      "evidence": {
        "snippet": "cb-h1",
        "normalized": "cb-h1"
      },
      "explanation": "stub",
      "fix_sketch": "stub",
      "tool_origin": "agent",
      "phase": 1
    },
    {
      "id": "f-f567e90f2040426f",
      "severity": "high",
      "primary_dimension": "spec-stability",
      "title": "stub: cb-h2",
      "location": {
        "file": "app/cb-h2.rb",
        "line": 1
      },
      "evidence": {
        "snippet": "cb-h2",
        "normalized": "cb-h2"
      },
      "explanation": "stub",
      "fix_sketch": "stub",
      "tool_origin": "agent",
      "phase": 1
    },
    {
      "id": "f-e9c2e9e4aafc3837",
      "severity": "high",
      "primary_dimension": "deploy-and-ci",
      "title": "stub: cb-h3",
      "location": {
        "file": "app/cb-h3.rb",
        "line": 1
      },
      "evidence": {
        "snippet": "cb-h3",
        "normalized": "cb-h3"
      },
      "explanation": "stub",
      "fix_sketch": "stub",
      "tool_origin": "agent",
      "phase": 1
    },
    {
      "id": "f-aed69157cdcf8eda",
      "severity": "medium",
      "primary_dimension": "security-and-authz",
      "title": "stub: cb-m1",
      "location": {
        "file": "app/cb-m1.rb",
        "line": 1
      },
      "evidence": {
        "snippet": "cb-m1",
        "normalized": "cb-m1"
      },
      "explanation": "stub",
      "fix_sketch": "stub",
      "tool_origin": "agent",
      "phase": 1
    },
    {
      "id": "f-16503f1ada5e9e61",
      "severity": "medium",
      "primary_dimension": "authorization",
      "title": "stub: cb-m2",
      "location": {
        "file": "app/cb-m2.rb",
        "line": 1
      },
      "evidence": {
        "snippet": "cb-m2",
        "normalized": "cb-m2"
      },
      "explanation": "stub",
      "fix_sketch": "stub",
      "tool_origin": "agent",
      "phase": 1
    },
    {
      "id": "f-d2304e672958b948",
      "severity": "medium",
      "primary_dimension": "money-and-payments",
      "title": "stub: cb-m3",
      "location": {
        "file": "app/cb-m3.rb",
        "line": 1
      },
      "evidence": {
        "snippet": "cb-m3",
        "normalized": "cb-m3"
      },
      "explanation": "stub",
      "fix_sketch": "stub",
      "tool_origin": "agent",
      "phase": 1
    },
    {
      "id": "f-b4422c6296c514bc",
      "severity": "medium",
      "primary_dimension": "risk-hotspots",
      "title": "stub: cb-m4",
      "location": {
        "file": "app/cb-m4.rb",
        "line": 1
      },
      "evidence": {
        "snippet": "cb-m4",
        "normalized": "cb-m4"
      },
      "explanation": "stub",
      "fix_sketch": "stub",
      "tool_origin": "agent",
      "phase": 1
    },
    {
      "id": "f-59f9c1c83d52c545",
      "severity": "low",
      "primary_dimension": "code-smells",
      "title": "stub: cb-l1",
      "location": {
        "file": "app/cb-l1.rb",
        "line": 1
      },
      "evidence": {
        "snippet": "cb-l1",
        "normalized": "cb-l1"
      },
      "explanation": "stub",
      "fix_sketch": "stub",
      "tool_origin": "agent",
      "phase": 1
    },
    {
      "id": "f-7c5a92685291b6bd",
      "severity": "low",
      "primary_dimension": "test-coverage",
      "title": "stub: cb-l2",
      "location": {
        "file": "app/cb-l2.rb",
        "line": 1
      },
      "evidence": {
        "snippet": "cb-l2",
        "normalized": "cb-l2"
      },
      "explanation": "stub",
      "fix_sketch": "stub",
      "tool_origin": "agent",
      "phase": 1
    }
  ],
  "tooling": {
    "ran": [],
    "missing": [],
    "skipped": []
  }
}
