{
  "schema_version": 2,
  "skill_version": "0.6.0",
  "audit": {
    "id": "00000000-0000-4000-8000-000000999999",
    "started_at": "2026-05-06T00:00:00Z",
    "finished_at": "2026-05-06T00:01:00Z",
    "mode": "standard",
    "scope": ["all"],
    "commit": "deadbeef0001",
    "branch": "main",
    "project_name": "fixture",
    "stack": {
      "ruby": "3.4.7",
      "rails": "8.1.3",
      "deploy_target": "cloud_run",
      "job_adapter": "sidekiq",
      "auth_strategy": "devise",
      "test_framework": "rspec"
    },
    "ignore_warnings": []
  },
  "summary": {
    "risk_score": 5,
    "verdict": "Fixture report for bin/file-issues tests.",
    "top_blocker_ids": ["f-aaaaaaaaaaaa0001"],
    "next_action": "Phase 1."
  },
  "scorecards": [],
  "findings": [
    {
      "id": "f-aaaaaaaaaaaa0001",
      "severity": "blocker",
      "primary_dimension": "security-and-authz",
      "title": "API token compared with == (timing-attack)",
      "location": { "file": "app/controllers/api/base_controller.rb", "line": 53 },
      "evidence": { "snippet": "if token == ENV['API_TOKEN']", "normalized": "token == ENV['API_TOKEN']" },
      "explanation": "String equality is not constant-time and leaks information about the secret.",
      "fix_sketch": "Use ActiveSupport::SecurityUtils.secure_compare with both strings padded to equal length.",
      "time_estimate": "5m",
      "tool_origin": "agent",
      "phase": 1
    },
    {
      "id": "f-aaaaaaaaaaaa0002",
      "severity": "high",
      "primary_dimension": "deploy-and-ci",
      "title": "force_ssl disabled in production",
      "location": { "file": "config/environments/production.rb", "line": 31 },
      "evidence": { "snippet": "# config.force_ssl = true", "normalized": "config.force_ssl = true (commented)" },
      "explanation": "TLS termination at the load balancer doesn't redirect plain-HTTP requests; cookies leak.",
      "fix_sketch": "Uncomment config.force_ssl = true.",
      "time_estimate": "5m",
      "tool_origin": "agent",
      "phase": 1
    },
    {
      "id": "f-aaaaaaaaaaaa0003",
      "severity": "medium",
      "primary_dimension": "test-coverage",
      "title": "No SimpleCov configured",
      "location": { "file": "Gemfile" },
      "evidence": { "snippet": "# coverage TBD", "normalized": "no simplecov" },
      "explanation": "Without coverage instrumentation, regressions are invisible.",
      "fix_sketch": "Add simplecov to :test group; configure spec_helper.rb.",
      "time_estimate": "1h",
      "tool_origin": "agent",
      "phase": 2
    }
  ],
  "tooling": {
    "ran": [],
    "missing": [],
    "skipped": []
  },
  "fix_sequence": [
    {
      "phase": 1,
      "name": "Make deploys safe",
      "estimated_effort": "1d",
      "rationale": "Highest-priority security + deploy-safety blockers.",
      "finding_ids": ["f-aaaaaaaaaaaa0001", "f-aaaaaaaaaaaa0002"]
    },
    {
      "phase": 2,
      "name": "Coverage + observability",
      "estimated_effort": "1w",
      "rationale": "Reduce regression blind spots.",
      "finding_ids": ["f-aaaaaaaaaaaa0003"]
    }
  ]
}
